{
  "$schema": "https://json-schema.org/draft/2020-12/schema",
  "$id": "https://wheelsmif.github.io/geovisor/schemas/tir.schema.json",
  "title": "GEO-Visor Tool Intermediate Representation",
  "type": "object",
  "additionalProperties": false,
  "required": ["schemaVersion", "source", "frameCoverage", "tools", "warnings"],
  "properties": {
    "schemaVersion": { "const": "1.2.0" },
    "source": { "$ref": "#/$defs/sourceMetadata" },
    "frameCoverage": { "$ref": "#/$defs/frameCoverage" },
    "tools": {
      "type": "array",
      "items": { "$ref": "#/$defs/tool" }
    },
    "warnings": {
      "type": "array",
      "items": { "$ref": "#/$defs/warning" }
    }
  },
  "$defs": {
    "sourceMetadata": {
      "type": "object",
      "additionalProperties": false,
      "required": ["kind", "executionBoundary", "stealthEnabled"],
      "properties": {
        "kind": { "enum": ["launch_url", "cdp_attach"] },
        "executionBoundary": { "const": "agent_owned" },
        "requestedUrl": { "type": "string" },
        "finalUrl": { "type": "string" },
        "stealthEnabled": { "type": "boolean" }
      }
    },
    "frameCoverage": {
      "type": "object",
      "additionalProperties": false,
      "required": ["status", "frames", "uncovered"],
      "properties": {
        "status": { "enum": ["complete", "partial", "unavailable"] },
        "frames": {
          "type": "array",
          "items": { "$ref": "#/$defs/coveredFrame" }
        },
        "uncovered": {
          "type": "array",
          "items": { "$ref": "#/$defs/uncoveredFrame" }
        }
      },
      "allOf": [
        {
          "if": {
            "properties": { "status": { "const": "partial" } },
            "required": ["status"]
          },
          "then": {
            "properties": { "uncovered": { "minItems": 1 } }
          }
        },
        {
          "if": {
            "properties": { "status": { "const": "complete" } },
            "required": ["status"]
          },
          "then": {
            "properties": { "uncovered": { "maxItems": 0 } }
          }
        },
        {
          "if": {
            "properties": { "status": { "const": "unavailable" } },
            "required": ["status"]
          },
          "then": {
            "properties": {
              "frames": { "maxItems": 0 },
              "uncovered": { "maxItems": 0 }
            }
          }
        }
      ]
    },
    "coveredFrame": {
      "type": "object",
      "additionalProperties": false,
      "required": ["path"],
      "properties": {
        "path": {
          "type": "array",
          "items": { "$ref": "#/$defs/frameReference" }
        },
        "url": { "type": "string" },
        "origin": { "type": "string" }
      }
    },
    "uncoveredFrame": {
      "type": "object",
      "additionalProperties": false,
      "required": ["path", "reason"],
      "properties": {
        "path": {
          "type": "array",
          "items": { "$ref": "#/$defs/frameReference" }
        },
        "reason": { "type": "string", "minLength": 1, "pattern": "\\S" }
      }
    },
    "frameReference": {
      "type": "object",
      "additionalProperties": false,
      "required": ["index"],
      "properties": {
        "index": { "type": "integer", "minimum": 0 },
        "name": { "type": "string" },
        "src": { "type": "string" }
      }
    },
    "tool": {
      "type": "object",
      "additionalProperties": false,
      "required": [
        "id",
        "name",
        "parameters",
        "locatorCandidates",
        "actionBindings",
        "confidence",
        "provenance"
      ],
      "properties": {
        "id": {
          "type": "string",
          "minLength": 1,
          "maxLength": 64,
          "pattern": "^[A-Za-z0-9_-]+$"
        },
        "name": { "type": "string", "minLength": 1, "pattern": "\\S" },
        "description": { "type": "string" },
        "parameters": {
          "type": "array",
          "items": { "$ref": "#/$defs/parameter" }
        },
        "locatorCandidates": {
          "type": "array",
          "items": { "$ref": "#/$defs/locatorCandidate" }
        },
        "actionBindings": {
          "type": "array",
          "minItems": 1,
          "items": { "$ref": "#/$defs/actionBinding" }
        },
        "confidence": { "$ref": "#/$defs/confidence" },
        "provenance": {
          "type": "array",
          "items": { "$ref": "#/$defs/provenance" }
        }
      }
    },
    "parameter": {
      "type": "object",
      "additionalProperties": false,
      "required": ["name", "type", "required"],
      "properties": {
        "name": { "type": "string", "minLength": 1, "pattern": "\\S" },
        "description": { "type": "string" },
        "type": { "$ref": "#/$defs/valueType" },
        "required": { "type": "boolean" },
        "enum": {
          "type": "array",
          "uniqueItems": true,
          "items": { "type": "string" }
        },
        "items": { "$ref": "#/$defs/parameterShape" },
        "properties": {
          "type": "array",
          "items": { "$ref": "#/$defs/parameterProperty" }
        }
      },
      "allOf": [{ "$ref": "#/$defs/shapeCompatibility" }]
    },
    "parameterShape": {
      "type": "object",
      "additionalProperties": false,
      "required": ["type"],
      "properties": {
        "type": { "$ref": "#/$defs/valueType" },
        "enum": {
          "type": "array",
          "uniqueItems": true,
          "items": { "type": "string" }
        },
        "items": { "$ref": "#/$defs/parameterShape" },
        "properties": {
          "type": "array",
          "items": { "$ref": "#/$defs/parameterProperty" }
        }
      },
      "allOf": [{ "$ref": "#/$defs/shapeCompatibility" }]
    },
    "shapeCompatibility": {
      "allOf": [
        {
          "if": {
            "properties": { "type": { "const": "array" } },
            "required": ["type"]
          },
          "then": {
            "required": ["items"],
            "properties": {
              "enum": { "maxItems": 0 },
              "properties": { "maxItems": 0 }
            }
          }
        },
        {
          "if": {
            "properties": { "type": { "const": "object" } },
            "required": ["type"]
          },
          "then": {
            "not": { "required": ["items"] },
            "properties": {
              "enum": { "maxItems": 0 }
            }
          }
        },
        {
          "if": {
            "properties": { "type": { "const": "string" } },
            "required": ["type"]
          },
          "then": {
            "not": { "required": ["items"] },
            "properties": {
              "properties": { "maxItems": 0 }
            }
          }
        },
        {
          "if": {
            "properties": { "type": { "enum": ["number", "integer", "boolean"] } },
            "required": ["type"]
          },
          "then": {
            "not": { "required": ["items"] },
            "properties": {
              "enum": { "maxItems": 0 },
              "properties": { "maxItems": 0 }
            }
          }
        }
      ]
    },
    "parameterProperty": {
      "type": "object",
      "additionalProperties": false,
      "required": ["name", "required", "shape"],
      "properties": {
        "name": { "type": "string", "minLength": 1, "pattern": "\\S" },
        "description": { "type": "string" },
        "required": { "type": "boolean" },
        "shape": { "$ref": "#/$defs/parameterShape" }
      }
    },
    "valueType": {
      "enum": ["string", "number", "integer", "boolean", "object", "array"]
    },
    "locatorCandidate": {
      "type": "object",
      "additionalProperties": false,
      "required": [
        "id",
        "framePath",
        "shadowPath",
        "confidence",
        "provenance"
      ],
      "anyOf": [
        { "required": ["semantic"] },
        { "required": ["cssFallback"] }
      ],
      "properties": {
        "id": { "type": "string", "minLength": 1, "pattern": "\\S" },
        "framePath": {
          "type": "array",
          "items": { "$ref": "#/$defs/pathNode" }
        },
        "shadowPath": {
          "type": "array",
          "items": { "$ref": "#/$defs/pathNode" }
        },
        "semantic": { "$ref": "#/$defs/semanticLocator" },
        "cssFallback": { "type": "string", "minLength": 1, "pattern": "\\S" },
        "confidence": { "$ref": "#/$defs/confidence" },
        "provenance": {
          "type": "array",
          "items": { "$ref": "#/$defs/provenance" }
        }
      }
    },
    "pathNode": {
      "type": "object",
      "additionalProperties": false,
      "anyOf": [
        { "required": ["semantic"] },
        { "required": ["cssFallback"] }
      ],
      "properties": {
        "semantic": { "$ref": "#/$defs/semanticNode" },
        "cssFallback": { "type": "string", "minLength": 1, "pattern": "\\S" }
      }
    },
    "semanticLocator": {
      "type": "object",
      "additionalProperties": false,
      "required": ["scope", "role"],
      "properties": {
        "scope": {
          "type": "array",
          "items": { "$ref": "#/$defs/semanticNode" }
        },
        "role": { "type": "string", "minLength": 1, "pattern": "\\S" },
        "name": { "type": "string" },
        "nth": { "type": "integer", "minimum": 0 }
      }
    },
    "semanticNode": {
      "type": "object",
      "additionalProperties": false,
      "required": ["role"],
      "properties": {
        "role": { "type": "string", "minLength": 1, "pattern": "\\S" },
        "name": { "type": "string" },
        "nth": {
          "description": "Index among the elements matching this role and name, in document order. Absent means the first, and is the only valid form when the match is unique.",
          "type": "integer",
          "minimum": 0
        }
      }
    },
    "actionBinding": {
      "type": "object",
      "additionalProperties": false,
      "required": ["action", "locatorCandidateIds", "sideEffect"],
      "properties": {
        "action": { "enum": ["click", "fill", "select", "check"] },
        "inputParameter": { "type": "string", "minLength": 1, "pattern": "\\S" },
        "locatorCandidateIds": {
          "type": "array",
          "uniqueItems": true,
          "items": { "type": "string", "minLength": 1, "pattern": "\\S" }
        },
        "locatorSelection": { "enum": ["ranked", "by_target_name"] },
        "sideEffect": { "$ref": "#/$defs/sideEffect" }
      },
      "allOf": [
        {
          "if": {
            "properties": { "locatorCandidateIds": { "minItems": 1 } },
            "required": ["locatorCandidateIds"]
          },
          "then": { "required": ["locatorSelection"] }
        }
      ]
    },
    "sideEffect": {
      "type": "object",
      "additionalProperties": false,
      "required": ["class", "safeForExploration"],
      "properties": {
        "class": {
          "enum": [
            "none",
            "local_state",
            "network",
            "navigation",
            "submission",
            "unknown"
          ]
        },
        "safeForExploration": { "type": "boolean" },
        "rationale": { "type": "string" }
      },
      "allOf": [
        {
          "if": {
            "properties": {
              "class": { "enum": ["navigation", "submission", "unknown"] }
            },
            "required": ["class"]
          },
          "then": {
            "properties": {
              "safeForExploration": { "const": false }
            }
          }
        }
      ]
    },
    "confidence": {
      "type": "object",
      "additionalProperties": false,
      "required": ["score"],
      "properties": {
        "score": { "type": "number", "minimum": 0, "maximum": 1 },
        "rationale": { "type": "string" }
      }
    },
    "provenance": {
      "type": "object",
      "additionalProperties": false,
      "required": ["kind"],
      "properties": {
        "kind": {
          "enum": ["dom", "accessibility", "page_metadata", "heuristic"]
        },
        "reference": { "type": "string" }
      }
    },
    "warning": {
      "type": "object",
      "additionalProperties": false,
      "required": ["code", "message", "framePath"],
      "properties": {
        "code": { "type": "string", "minLength": 1, "pattern": "\\S" },
        "message": { "type": "string", "minLength": 1, "pattern": "\\S" },
        "toolId": { "type": "string", "minLength": 1 },
        "framePath": {
          "type": "array",
          "items": { "$ref": "#/$defs/frameReference" }
        }
      }
    }
  }
}
