{"schemaVersion":"1.2.0","source":{"kind":"launch_url","executionBoundary":"agent_owned","requestedUrl":"https://example.test/","finalUrl":"https://example.test/","stealthEnabled":false},"frameCoverage":{"status":"partial","frames":[{"path":[],"url":"https://example.test/","origin":"https://example.test"}],"uncovered":[{"path":[{"index":0,"name":"payments","src":"https://pay.example.test"}],"reason":"cross-origin frame"}]},"tools":[{"id":"search-2880204d3af8","name":"Search","description":"Search the catalog","parameters":[{"name":"query","type":"string","required":true},{"name":"category","type":"string","required":false,"enum":["Books","Games"]}],"locatorCandidates":[{"id":"search-2880204d3af8-locator-searchbox-search-products-efc4b7ad1405","framePath":[],"shadowPath":[],"semantic":{"scope":[],"role":"searchbox","name":"Search products"},"confidence":{"score":0.9,"rationale":"noisy-or aggregation of 1 unique evidence item(s)"},"provenance":[{"kind":"accessibility","reference":"ax:search"}]},{"id":"search-2880204d3af8-locator-css-a5c92ce2be16","framePath":[],"shadowPath":[],"cssFallback":"#catalog-search","confidence":{"score":0.7,"rationale":"noisy-or aggregation of 1 unique evidence item(s)"},"provenance":[{"kind":"dom","reference":"dom:#catalog-search"}]}],"actionBindings":[{"action":"fill","inputParameter":"query","locatorCandidateIds":["search-2880204d3af8-locator-searchbox-search-products-efc4b7ad1405"],"locatorSelection":"ranked","sideEffect":{"class":"network","safeForExploration":false,"rationale":"may request suggestions"}}],"confidence":{"score":0.96,"rationale":"noisy-or aggregation of 2 unique evidence item(s)"},"provenance":[{"kind":"accessibility","reference":"ax:form"},{"kind":"dom","reference":"dom:form"}]},{"id":"search-40ee180f8171","name":"Search","description":"Search help","parameters":[{"name":"query","type":"string","required":true},{"name":"category","type":"string","required":false,"enum":["Books","Games"]}],"locatorCandidates":[{"id":"search-40ee180f8171-locator-searchbox-search-products-efc4b7ad1405","framePath":[],"shadowPath":[],"semantic":{"scope":[],"role":"searchbox","name":"Search products"},"confidence":{"score":0.9,"rationale":"noisy-or aggregation of 1 unique evidence item(s)"},"provenance":[{"kind":"accessibility","reference":"ax:search"}]}],"actionBindings":[{"action":"fill","inputParameter":"query","locatorCandidateIds":["search-40ee180f8171-locator-searchbox-search-products-efc4b7ad1405"],"locatorSelection":"ranked","sideEffect":{"class":"none","safeForExploration":true}}],"confidence":{"score":0.96,"rationale":"noisy-or aggregation of 2 unique evidence item(s)"},"provenance":[{"kind":"accessibility","reference":"ax:form"},{"kind":"dom","reference":"dom:form"}]}],"warnings":[{"code":"ambiguous_side_effect","message":"conflicting side-effect classes; selected the most conservative","toolId":"search-2880204d3af8","framePath":[]},{"code":"css_fallback","message":"locator relies only on a CSS fallback","toolId":"search-2880204d3af8","framePath":[]},{"code":"frame_uncovered","message":"frame coverage is incomplete","framePath":[{"index":0,"name":"payments","src":"https://pay.example.test"}]}]}
